{
  "protocol": "droplink.drop_capsule",
  "version": "0.1",
  "source": {
    "type": "agent",
    "url": "https://anky.app",
    "domain": "anky.app",
    "title": "Anky"
  },
  "project": {
    "name": "Anky",
    "one_liner": "A writing and memory project for people turning lived experience into durable lore.",
    "brand_summary": "Anky blends personal writing, daily practice, and agent-native tools into a public creative system. The public-safe lore is about consistency, memory, and turning inner work into artifacts without exposing private journals.",
    "audience": "writers, builders, reflective creators, and agent-native internet people",
    "voice": ["direct", "ritual-aware", "internet-native"],
    "forbidden_vibes": ["generic AI merch", "counterfeit logo merch", "private journal content"]
  },
  "drop": {
    "collection_name": "The Daily Lore Drop",
    "collection_tagline": "your practice became a storefront.",
    "visual_direction": "Warm high-contrast product mockups with notebook texture, clean black type, a bright orange signal mark, and no exact unauthorized logos.",
    "products": [
      {
        "name": "Proof of Practice Tee",
        "type": "t-shirt",
        "description": "A crisp tee for people who keep showing up before the internet notices.",
        "why_this_product": "The tee turns the daily practice loop into a simple wearable signal.",
        "price_cents": 4400,
        "currency": "usd",
        "image_prompt": "White t-shirt mockup, bright orange signal mark, notebook texture background, clean type, no exact logo."
      },
      {
        "name": "Lore Keeper Hoodie",
        "type": "hoodie",
        "description": "A heavyweight hoodie for cold mornings, long drafts, and memory work.",
        "why_this_product": "The hoodie gives the drop a premium object for the most committed community members.",
        "price_cents": 6800,
        "currency": "usd",
        "image_prompt": "Black hoodie mockup, subtle notebook-grid texture, orange accent, agent-native writing energy."
      },
      {
        "name": "Ninety Day Signal Poster",
        "type": "poster",
        "description": "A wall print that makes the compounding effect of daily writing visible.",
        "why_this_product": "The poster captures the project lore without using private user writing.",
        "price_cents": 2800,
        "currency": "usd",
        "image_prompt": "Minimal poster mockup, 90 small marks forming a signal, warm paper, black ink, orange accent."
      }
    ]
  },
  "commerce": {
    "platform_fee_bps": 800,
    "requires_claim_for_live_sales": true
  },
  "approval": {
    "status": "preview",
    "approved_by": null
  }
}
